{
  "schema_version": 1,
  "profile": "p0",
  "spec": {
    "name": "RISC-V Privileged Architecture Specification",
    "version": "v1.12",
    "tag": "Priv-v1.12",
    "commit": "98964261c931d51884f733664b22efe43de93033"
  },
  "kind_semantics": {
    "strict": "The field's value is fully determined by the write and the register's reset state; the comparator requires the read-back to equal the ledger's expected value exactly and rejects any other value.",
    "warl_allowed": "The field is WARL with a stated legal set; the comparator accepts a legal result and rejects the adjacent illegal one (the read must never equal the value the rule marks illegal).",
    "read_only": "Software can never change the field; the comparator requires the read-back to equal the field's fixed value after a write attempt and rejects the written value appearing.",
    "alias": "Two addresses read the same state; the comparator requires the alias read to track the canonical register across two different writes and rejects a result that does not.",
    "permission": "The access is permitted only when the address is implemented and its encoding allows the operation; the comparator requires an illegal access to raise the illegal-instruction exception and to leave the destination and state unchanged, and rejects an access accepted as zero."
  },
  "rules": [
    {
      "id": "mstatus.SIE",
      "csr": "mstatus",
      "address": 768,
      "field": "SIE",
      "bits": "1",
      "kind": "strict",
      "clause": "RISC-V Privileged Spec v1.12, tag Priv-v1.12 commit 98964261c931d51884f733664b22efe43de93033. Address and privilege: src/priv-csrs.tex L303 '0x300 & MRW & mstatus'. src/machine.tex: section 'Machine Status Registers (mstatus and mstatush)' L363, 'The mstatus register is an MXLEN-bit read/write register' L365; RV64 layout figure mstatusreg L441-L520, bit-number header rows L448-L495 and field-name rows L462-L474 / L497-L511 (SD 63, WPRI 62:38, MBE 37, SBE 36, SXL 35:34, UXL 33:32, WPRI 31:23, TSR 22, TW 21, TVM 20, MXR 19, SUM 18, MPRV 17, XS 16:15, FS 14:13, MPP 12:11, VS 10:9, SPP 8, MPIE 7, UBE 6, SPIE 5, WPRI 4, MIE 3, WPRI 2, SIE 1, WPRI 0); mstatush is 'For RV32 only' L522 and is therefore excluded. Per-field rules: xPP WARL and 'If privilege mode x is not implemented, then x/PP must be read-only 0' L621-L623; SXL read-only zero without S-mode L646-L647; UXL read-only zero without U-mode L651-L652; 'MPRV is read-only 0 if U-mode is not supported' L688; MXR read-only 0 without S-mode L697-L698; SUM read-only 0 without S-mode L718-L719; MBE/SBE/UBE WARL L727-L728, SBE read-only 0 without S-mode L736, UBE read-only 0 without U-mode L740, 'An implementation supports only little-endian memory accesses if fields MBE, SBE, and UBE are all read-only 0' L767-L768; TVM read-only 0 without S-mode L821; TW read-only 0 with no mode less privileged than M L841-L842; TSR read-only 0 without S-mode L860-L861; FS read-only zero without F or S-mode L928; VS read-only zero without V or S-mode L944; 'XS field is read-only zero' L950. Reset: section 'Reset' L2839, 'The mstatus fields MIE and MPRV are reset to 0' L2842-L2843, 'If little-endian memory accesses are supported, the mstatus/mstatush field MBE is reset to 0' L2844-L2845, 'All other hart state is unspecified' L2858; MosaicRV sets MPP=0b11 so no WARL field holds an illegal value (L2857), giving reset = 3<<11 = 0x1800. p0 is M-mode only and little-endian (config/profiles/p0.json), which forces every field except MPIE/SPIE/MIE/SIE to read-only zero and MPP to read-only 0b11.; FS [14:13] and VS [10:9] are WARL extension-state fields. When the F extension is implemented FS shall not be read-only zero and reads as Dirty when any floating-point state is dirty; the same holds for VS and the V extension. A profile claiming neither reads them as zero Field-level rules the RTL implements and the generator narrows per profile: MPP (12:11) holds the previous privilege (only M in an M-only profile, 'implementations that support only M-mode may hardwire MPP to 3'); SPP (8) the same for a trap into S; MPRV (17) 'is read-only 0 if U-mode is not supported' and otherwise selects MPP as the effective privilege of loads and stores; SUM (18) and MXR (19) adjust S-mode page permissions and are read-only 0 with no S-mode; TVM (20), TW (21) and TSR (22) intercept S-mode satp access, WFI and SRET respectively and are read-only 0 with no S-mode. tools/gen_manifest.py subtracts exactly those bits for a profile whose privilege_modes list has no S or U, so one table describes every profile.",
      "preconditions": [
        "profile p0 implements mstatus at 0x300",
        "the hart runs in M-mode (p0 privilege_modes == [M]); every implemented CSR is M-accessible"
      ],
      "positive": {
        "op": "csrrw",
        "write": "0x0000000000000002",
        "traps": 0,
        "expect": {
          "read": "0x0000000000001802"
        }
      },
      "negative": {
        "op": "csrrw",
        "write": "0x0000000000000000",
        "traps": 0,
        "expect": {
          "read": "0x0000000000001800"
        },
        "forbid": "0x0000000000001802"
      }
    },
    {
      "id": "mstatus.MIE",
      "csr": "mstatus",
      "address": 768,
      "field": "MIE",
      "bits": "3",
      "kind": "strict",
      "clause": "RISC-V Privileged Spec v1.12, tag Priv-v1.12 commit 98964261c931d51884f733664b22efe43de93033. Address and privilege: src/priv-csrs.tex L303 '0x300 & MRW & mstatus'. src/machine.tex: section 'Machine Status Registers (mstatus and mstatush)' L363, 'The mstatus register is an MXLEN-bit read/write register' L365; RV64 layout figure mstatusreg L441-L520, bit-number header rows L448-L495 and field-name rows L462-L474 / L497-L511 (SD 63, WPRI 62:38, MBE 37, SBE 36, SXL 35:34, UXL 33:32, WPRI 31:23, TSR 22, TW 21, TVM 20, MXR 19, SUM 18, MPRV 17, XS 16:15, FS 14:13, MPP 12:11, VS 10:9, SPP 8, MPIE 7, UBE 6, SPIE 5, WPRI 4, MIE 3, WPRI 2, SIE 1, WPRI 0); mstatush is 'For RV32 only' L522 and is therefore excluded. Per-field rules: xPP WARL and 'If privilege mode x is not implemented, then x/PP must be read-only 0' L621-L623; SXL read-only zero without S-mode L646-L647; UXL read-only zero without U-mode L651-L652; 'MPRV is read-only 0 if U-mode is not supported' L688; MXR read-only 0 without S-mode L697-L698; SUM read-only 0 without S-mode L718-L719; MBE/SBE/UBE WARL L727-L728, SBE read-only 0 without S-mode L736, UBE read-only 0 without U-mode L740, 'An implementation supports only little-endian memory accesses if fields MBE, SBE, and UBE are all read-only 0' L767-L768; TVM read-only 0 without S-mode L821; TW read-only 0 with no mode less privileged than M L841-L842; TSR read-only 0 without S-mode L860-L861; FS read-only zero without F or S-mode L928; VS read-only zero without V or S-mode L944; 'XS field is read-only zero' L950. Reset: section 'Reset' L2839, 'The mstatus fields MIE and MPRV are reset to 0' L2842-L2843, 'If little-endian memory accesses are supported, the mstatus/mstatush field MBE is reset to 0' L2844-L2845, 'All other hart state is unspecified' L2858; MosaicRV sets MPP=0b11 so no WARL field holds an illegal value (L2857), giving reset = 3<<11 = 0x1800. p0 is M-mode only and little-endian (config/profiles/p0.json), which forces every field except MPIE/SPIE/MIE/SIE to read-only zero and MPP to read-only 0b11.; FS [14:13] and VS [10:9] are WARL extension-state fields. When the F extension is implemented FS shall not be read-only zero and reads as Dirty when any floating-point state is dirty; the same holds for VS and the V extension. A profile claiming neither reads them as zero Field-level rules the RTL implements and the generator narrows per profile: MPP (12:11) holds the previous privilege (only M in an M-only profile, 'implementations that support only M-mode may hardwire MPP to 3'); SPP (8) the same for a trap into S; MPRV (17) 'is read-only 0 if U-mode is not supported' and otherwise selects MPP as the effective privilege of loads and stores; SUM (18) and MXR (19) adjust S-mode page permissions and are read-only 0 with no S-mode; TVM (20), TW (21) and TSR (22) intercept S-mode satp access, WFI and SRET respectively and are read-only 0 with no S-mode. tools/gen_manifest.py subtracts exactly those bits for a profile whose privilege_modes list has no S or U, so one table describes every profile.",
      "preconditions": [
        "profile p0 implements mstatus at 0x300",
        "the hart runs in M-mode (p0 privilege_modes == [M]); every implemented CSR is M-accessible"
      ],
      "positive": {
        "op": "csrrw",
        "write": "0x0000000000000008",
        "traps": 0,
        "expect": {
          "read": "0x0000000000001808"
        }
      },
      "negative": {
        "op": "csrrw",
        "write": "0x0000000000000000",
        "traps": 0,
        "expect": {
          "read": "0x0000000000001800"
        },
        "forbid": "0x0000000000001808"
      }
    },
    {
      "id": "mstatus.SPIE",
      "csr": "mstatus",
      "address": 768,
      "field": "SPIE",
      "bits": "5",
      "kind": "strict",